{
  "schema_version": "1.0",
  "phase": "design",
  "inventory_fingerprint": "sha256:aaaaaaaaaaaaaaaaaaaaaaaaaaaaaaaaaaaaaaaaaaaaaaaaaaaaaaaaaaaaaaaa",
  "preferences_fingerprint": "sha256:cccccccccccccccccccccccccccccccccccccccccccccccccccccccccccccccc",
  "mappings": [
    {
      "source_resource_id": "rr-build", "render_kind": "render.build_source", "aws_service": "Amazon ECR + CI/CD immutable digest promotion", "aws_config": {"build_once": true}, "confidence": "deterministic", "disposition": "mapped", "rationale": "Preserves the shared immutable build artifact across environments.",
      "decision": {"selector": "delivery.build_source", "candidate_set": ["Amazon ECR + CI/CD immutable digest promotion", "Independent per-service builds"], "evidence": [{"ordinal": 1, "value": "Build Source feeds multiple environments"}], "rules_evaluated": [{"ordinal": 1, "value": "preserve build-once promotion"}], "rules_fired": [{"ordinal": 1, "value": "shared artifact requires immutable promotion"}], "questions_asked": [], "defaults_used": [], "rejected_candidates": [{"ordinal": 1, "aws_service": "Independent per-service builds", "reason": "Would rebuild and lose artifact identity."}]}
    },
    {
      "source_resource_id": "rr-cron", "render_kind": "render.cron_job", "aws_service": "Amazon EventBridge Scheduler + ECS on Fargate RunTask", "aws_config": {"time_zone": "UTC", "duration_minutes": 20}, "confidence": "inferred", "disposition": "mapped", "rationale": "Container job exceeds Lambda duration eligibility.",
      "decision": {"selector": "compute.cron", "candidate_set": ["Amazon EventBridge Scheduler + AWS Lambda", "Amazon EventBridge Scheduler + ECS on Fargate RunTask", "Amazon EventBridge Scheduler + AWS Batch"], "evidence": [{"ordinal": 1, "value": "User confirmed 20-minute duration"}], "rules_evaluated": [{"ordinal": 1, "value": "Batch eliminators"}, {"ordinal": 2, "value": "Lambda 15-minute ceiling"}], "rules_fired": [{"ordinal": 1, "value": "Lambda duration eliminator"}], "questions_asked": [{"ordinal": 1, "value": "cron.duration"}], "defaults_used": [], "rejected_candidates": [{"ordinal": 1, "aws_service": "Amazon EventBridge Scheduler + AWS Lambda", "reason": "Twenty minutes exceeds Lambda's 15-minute ceiling."}, {"ordinal": 2, "aws_service": "Amazon EventBridge Scheduler + AWS Batch", "reason": "No array, GPU, specialized compute, or Batch queue requirement."}]}
    },
    {
      "source_resource_id": "rr-db", "render_kind": "render.postgres", "aws_service": "Amazon RDS for PostgreSQL", "aws_config": {"multi_az": true, "migration_method": "AWS Database Migration Service"}, "confidence": "inferred", "disposition": "mapped", "rationale": "Conventional HA PostgreSQL with no Aurora-only requirement.",
      "decision": {"selector": "data.postgresql", "candidate_set": ["Amazon RDS for PostgreSQL", "Amazon Aurora PostgreSQL", "Self-managed PostgreSQL on Amazon EC2"], "evidence": [{"ordinal": 1, "value": "Managed targets preserve required PostgreSQL capabilities"}, {"ordinal": 2, "value": "Multi-AZ requirement without global readers"}], "rules_evaluated": [{"ordinal": 1, "value": "compatibility eliminators"}, {"ordinal": 2, "value": "Aurora-required outcomes"}, {"ordinal": 3, "value": "RDS-fit outcome"}], "rules_fired": [{"ordinal": 1, "value": "RDS-fit outcome"}], "questions_asked": [{"ordinal": 1, "value": "database.aurora_outcome"}], "defaults_used": [{"ordinal": 1, "value": "postgres.startup_fallback"}], "rejected_candidates": [{"ordinal": 1, "aws_service": "Amazon Aurora PostgreSQL", "reason": "No Global Database, reader autoscaling, Serverless, or Aurora-only requirement fired."}, {"ordinal": 2, "aws_service": "Self-managed PostgreSQL on Amazon EC2", "reason": "Both managed services preserve all non-negotiable capabilities."}]}
    },
    {
      "source_resource_id": "rr-disk", "render_kind": "render.persistent_disk", "aws_service": "Amazon EFS", "aws_config": {"mount_path": "/var/data", "transfer": "pre-copy and delta with writer quiescence"}, "confidence": "inferred", "disposition": "mapped", "rationale": "Shared POSIX access from Fargate requires EFS.",
      "decision": {"selector": "storage.persistent_disk", "candidate_set": ["Amazon EFS", "Amazon EBS", "Amazon S3", "Amazon S3-backed file access"], "evidence": [{"ordinal": 1, "value": "POSIX paths and multiple Fargate clients are required"}], "rules_evaluated": [{"ordinal": 1, "value": "object semantics"}, {"ordinal": 2, "value": "S3-backed path access"}, {"ordinal": 3, "value": "shared POSIX"}], "rules_fired": [{"ordinal": 1, "value": "shared POSIX on containers selects EFS"}], "questions_asked": [{"ordinal": 1, "value": "storage.access_semantics"}], "defaults_used": [], "rejected_candidates": [{"ordinal": 1, "aws_service": "Amazon EBS", "reason": "Compute is Fargate and single-AZ EC2 attachment is not acceptable."}, {"ordinal": 2, "aws_service": "Amazon S3", "reason": "Required POSIX locking and rename are not object semantics."}, {"ordinal": 3, "aws_service": "Amazon S3-backed file access", "reason": "S3 is not the required system of record."}]}
    },
    {
      "source_resource_id": "rr-domain", "render_kind": "render.custom_domain", "aws_service": "AWS Certificate Manager + external DNS", "aws_config": {"route53": false}, "confidence": "deterministic", "disposition": "mapped", "rationale": "AWS terminates TLS while the customer retains DNS.",
      "decision": {"selector": "network.custom_domain", "candidate_set": ["AWS Certificate Manager + external DNS", "AWS Certificate Manager + Amazon Route 53"], "evidence": [{"ordinal": 1, "value": "Customer confirmed external DNS ownership"}], "rules_evaluated": [{"ordinal": 1, "value": "Route 53 only when AWS owns DNS"}], "rules_fired": [{"ordinal": 1, "value": "retain external DNS"}], "questions_asked": [{"ordinal": 1, "value": "domain.dns_owner"}], "defaults_used": [], "rejected_candidates": [{"ordinal": 1, "aws_service": "AWS Certificate Manager + Amazon Route 53", "reason": "AWS will not own the DNS zone."}]}
    },
    {
      "source_resource_id": "rr-env", "render_kind": "render.environment", "aws_service": "AWS deployment environment stack", "aws_config": {"isolated_stack": true}, "confidence": "inferred", "disposition": "consumed_topology", "rationale": "Preserves the Render environment deployment boundary.",
      "decision": {"selector": "network.environment_boundary", "candidate_set": ["AWS deployment environment stack", "Shared unisolated resources"], "evidence": [{"ordinal": 1, "value": "Production environment is isolated"}], "rules_evaluated": [{"ordinal": 1, "value": "preserve environment isolation"}], "rules_fired": [{"ordinal": 1, "value": "isolated stack"}], "questions_asked": [], "defaults_used": [], "rejected_candidates": [{"ordinal": 1, "aws_service": "Shared unisolated resources", "reason": "Would erase the discovered environment boundary."}]}
    },
    {
      "source_resource_id": "rr-env-group", "render_kind": "render.environment_group", "aws_service": "AWS Secrets Manager + AWS Systems Manager Parameter Store", "aws_config": {"values_captured": false}, "confidence": "deterministic", "disposition": "mapped", "rationale": "Separates secret and non-secret configuration without capturing values.",
      "decision": {"selector": "delivery.environment_group", "candidate_set": ["AWS Secrets Manager + AWS Systems Manager Parameter Store", "Plaintext environment variables"], "evidence": [{"ordinal": 1, "value": "Environment group shares configuration names"}], "rules_evaluated": [{"ordinal": 1, "value": "separate secret and non-secret configuration"}], "rules_fired": [{"ordinal": 1, "value": "managed configuration stores"}], "questions_asked": [], "defaults_used": [], "rejected_candidates": [{"ordinal": 1, "aws_service": "Plaintext environment variables", "reason": "Would not preserve the secret-safety boundary."}]}
    },
    {
      "source_resource_id": "rr-kv", "render_kind": "render.key_value", "aws_service": "Amazon ElastiCache for Valkey node-based", "aws_config": {"node_type": "cache.m6g.large", "persistence": "off"}, "confidence": "inferred", "disposition": "mapped", "rationale": "Stable single-Region cache capacity fits node-based ElastiCache.",
      "decision": {"selector": "data.key_value", "candidate_set": ["Amazon ElastiCache for Valkey serverless", "Amazon ElastiCache for Valkey node-based", "Amazon MemoryDB", "Self-managed Valkey on Amazon EC2"], "evidence": [{"ordinal": 1, "value": "Single-Region cache with stable 3 GB capacity and persistence off"}], "rules_evaluated": [{"ordinal": 1, "value": "managed compatibility"}, {"ordinal": 2, "value": "MemoryDB-specific outcome"}, {"ordinal": 3, "value": "serverless versus node-based"}], "rules_fired": [{"ordinal": 1, "value": "stable node capacity"}], "questions_asked": [{"ordinal": 1, "value": "key_value.cross_region_writes"}], "defaults_used": [], "rejected_candidates": [{"ordinal": 1, "aws_service": "Amazon ElastiCache for Valkey serverless", "reason": "Stable known capacity favors node-based sizing."}, {"ordinal": 2, "aws_service": "Amazon MemoryDB", "reason": "No active-active cross-Region or MemoryDB-only durability requirement."}, {"ordinal": 3, "aws_service": "Self-managed Valkey on Amazon EC2", "reason": "Managed ElastiCache preserves required commands and eviction semantics."}]}
    },
    {
      "source_resource_id": "rr-private", "render_kind": "render.private_service", "aws_service": "ECS on Fargate", "aws_config": {"ingress": "AWS Cloud Map or ECS Service Connect", "public_load_balancer": false}, "confidence": "inferred", "disposition": "mapped", "rationale": "Direct task control with private-only service discovery.",